{
  "schema_id": "dance_pack",
  "schema_version": "v1",
  "metadata": {
    "id": "neo_soul_laidback_pocket_v1",
    "display_name": "Neo Soul (Laid-Back Pocket)",
    "dance_family": "blues_american",
    "version": "1.0.0",
    "author": "system",
    "license": "core",
    "engine_compatibility": ">=0.2.0",
    "tags": [
      "neo_soul",
      "pocket",
      "erykah",
      "dangelo",
      "laidback"
    ]
  },
  "groove": {
    "meter": "4/4",
    "cycle_bars": 4,
    "subdivision": "binary",
    "tempo_range_bpm": [
      65,
      90
    ],
    "swing_ratio": 0.15,
    "accent_grid": {
      "strong_beats": [
        2,
        4
      ],
      "secondary_beats": [
        1,
        3
      ],
      "ghost_allowed": true,
      "offbeat_emphasis": 0.4
    },
    "clave": {
      "type": "implicit",
      "pattern": [
        1,
        0,
        1,
        0,
        0,
        1,
        0,
        0
      ],
      "direction": "forward"
    }
  },
  "harmony_constraints": {
    "harmonic_rhythm": {
      "max_changes_per_cycle": 4,
      "min_beats_between_changes": 2,
      "change_on_strong_beat": "preferred"
    },
    "dominant_behavior": {
      "allowed": true,
      "resolution_strength": "medium",
      "secondary_dominants": true
    },
    "tritone_usage": {
      "allowed": true,
      "weight": "heavy",
      "forbidden_on_beats": [
        1,
        3
      ]
    },
    "chromatic_drift": {
      "allowed": true,
      "max_semitones": 3
    },
    "modal_constraints": {
      "parallel_minor_allowed": true,
      "modal_interchange_level": "free"
    }
  },
  "performance_profile": {
    "velocity_range": {
      "min": 40,
      "max": 95,
      "ghost_max": 28,
      "accent_min": 75
    },
    "pickup_bias": {
      "probability": 0.6,
      "max_offset_beats": 0.25
    },
    "contour_preference": {
      "stepwise_weight": 0.6,
      "leap_weight": 0.4,
      "max_leap_interval": 6
    },
    "ornament_density": "moderate",
    "register_bias": "mid",
    "articulation": {
      "default_duration_ratio": 0.8,
      "staccato_probability": 0.1,
      "legato_probability": 0.5
    }
  },
  "practice_mapping": {
    "primary_focus": [
      "groove_lock",
      "harmonic_awareness",
      "timing_accuracy"
    ],
    "evaluation_weights": {
      "timing_accuracy": 0.35,
      "harmonic_choice": 0.35,
      "dynamic_control": 0.15,
      "groove_feel": 0.15
    },
    "common_errors": [
      "rushed_tempo",
      "tritone_on_strong_beat",
      "lost_pulse",
      "over_ornamentation"
    ],
    "difficulty_rating": "advanced",
    "prerequisite_forms": [
      "funk_16th_pocket_v1"
    ]
  },
  "extensions": {}
}